{
  "id": "01J00000000000000000000C01",
  "parent_session_id": "01J000000000000000000WS001",
  "parent_turn_id": "01J00000000000000000000T01",
  "role": "explorer",
  "model": null,
  "prompt": "Find all call sites of loadConfig().",
  "result": null,
  "status": "running",
  "prompt_tokens": 0,
  "completion_tokens": 0,
  "total_tokens": 0,
  "created_at": "2026-07-28T12:00:00Z",
  "completed_at": null
}
